<?xml version="1.0" encoding="UTF-8"?>

<!ELEMENT DATAMODEL (NODE+)>
<!ATTLIST DATAMODEL
    name NMTOKEN #REQUIRED
    serialuid CDATA #REQUIRED
>
<!ELEMENT NODE EMPTY>
<!ATTLIST NODE
    name NMTOKEN #REQUIRED
    type CDATA #REQUIRED
    nullable (true | false) #REQUIRED
    autoincrement (true | false) #REQUIRED
    length CDATA #REQUIRED
    pk (true | false) #REQUIRED
>
