<?xml version="1.0"?>
<!DOCTYPE DATAMODEL SYSTEM "datamodel.dtd">
<!-- The DATAMODEL serves as a template for building Models in the Application.
    To ensure that these models correspond to a specification and will therefore 
    be able to be written back to a persistence layer.
    
    Generated by JetTools, do not edit this file directly.
    
    The name of the DataModel will be used to register the definition in a global 
    registry.  -->
<DATAMODEL name="Share" serialuid="1750601616L" >
    <!-- NODE 
        type : Java type for the node value
        name : Name the node is to be given
     -->
    <NODE type="Long" name="idShare" nullable="false" autoincrement="true" length="10" />
    <NODE type="Long" name="idPortfolio" nullable="false" autoincrement="false" length="10" />
    <NODE type="String" name="name" nullable="false" autoincrement="false" length="255" />
    <NODE type="String" name="description" nullable="true" autoincrement="false" length="4000" />
    <NODE type="String" name="code" nullable="true" autoincrement="false" length="45" />
    <NODE type="java.util.Date" name="datePurchase" nullable="false" autoincrement="false" length="10" />
    <NODE type="java.math.BigDecimal" name="purchasePrice" nullable="false" autoincrement="false" length="12" />
    <NODE type="java.math.BigDecimal" name="entryFee" nullable="true" autoincrement="false" length="12" />
</DATAMODEL>
