<?xml version="1.0"?>
<!DOCTYPE DATAMODEL SYSTEM "datamodel.dtd">
<!-- The DATAMODEL serves as a template for building Models in the Application.
    To ensure that these models correspond to a specification and will therefore
    be able to be written back to a persistence layer.

    Generated by JetTools, do not edit this file directly.

    The name of the DataModel will be used to register the definition in a global
    registry.  -->
<DATAMODEL name="ShareQuantity" serialuid="1077646545L" >
    <!-- NODE
        type : Java type for the node value
        name : Name the node is to be given
     -->
    <NODE type="Long" name="idShareQuantity" nullable="false" autoincrement="true" length="10" pk="true" />
    <NODE type="java.math.BigDecimal" name="changeFee" nullable="false" autoincrement="false" length="12" pk="false" />
    <NODE type="java.math.BigDecimal" name="changeQuantity" nullable="false" autoincrement="false" length="12" pk="false" />
    <NODE type="String" name="changeType" nullable="false" autoincrement="false" length="1" pk="false" />
    <NODE type="java.math.BigDecimal" name="changeValue" nullable="false" autoincrement="false" length="12" pk="false" />
    <NODE type="String" name="description" nullable="true" autoincrement="false" length="1000" pk="false" />
    <NODE type="Long" name="idShare" nullable="false" autoincrement="false" length="10" pk="false" />
    <NODE type="java.util.Date" name="valueDate" nullable="false" autoincrement="false" length="10" pk="false" />
</DATAMODEL>
