<?xml version="1.0"?>
<!DOCTYPE DATAMODEL SYSTEM "datamodel.dtd">
<!-- The DATAMODEL serves as a template for building Models in the Application.
    To ensure that these models correspond to a specification and will therefore
    be able to be written back to a persistence layer.

    Generated by JetTools, do not edit this file directly.

    The name of the DataModel will be used to register the definition in a global
    registry.  -->
<DATAMODEL name="PortfolioShare" serialuid="1L" persist="false" >
    <!-- NODE
        type : Java type for the node value
        name : Name the node is to be given
     -->
    <NODE type="Long" name="idPortfolio" nullable="false" autoincrement="false" length="10" pk="true" default="" />
    <NODE type="String" name="portfolioName" nullable="false" autoincrement="false" length="45" pk="false" default="" />
    <NODE type="Long" name="idShare" nullable="false" autoincrement="false" length="10" pk="true" default="" />
    <NODE type="String" name="shareName" nullable="false" autoincrement="false" length="255" pk="false" default="" />
    <NODE type="java.util.Date" name="valueDate" nullable="false" autoincrement="false" length="10" pk="false" default="" />
    <NODE type="java.math.BigDecimal" name="changeQuantity" nullable="false" autoincrement="false" length="12" pk="false" default="" />
    <NODE type="java.math.BigDecimal" name="value" nullable="false" autoincrement="false" length="12" pk="false" default="" />
    <NODE type="java.math.BigDecimal" name="totalQuantity" nullable="false" autoincrement="false" length="12" pk="false" default="" />
</DATAMODEL>
